{
  "format": 1,
  "name": "core/mth2008",
  "version": "1.0.0",
  "title": "Real Analysis",
  "courses": [
    "MTH2008"
  ],
  "summary": "Results from the MTH2008 lecture notes, restated and proved in the checker's notation; references follow the notes' numbering.",
  "authors": [
    "Samuel Okwuonu"
  ],
  "license": "CC-BY-SA-4.0",
  "engine": ">=0.1",
  "depends": {},
  "chapters": [
    {
      "id": "1",
      "title": "The Real Numbers"
    },
    {
      "id": "2",
      "title": "Differential Calculus of Functions of One Variable"
    },
    {
      "id": "3",
      "title": "Infinite Sequences and Series"
    },
    {
      "id": "4",
      "title": "Continuity and Differentiability"
    },
    {
      "id": "5",
      "title": "Integrability"
    }
  ],
  "entries": [
    {
      "id": "1-1-field-manipulations",
      "chapter": "1",
      "ref": "§1.1",
      "title": "Field manipulations",
      "kind": "proof",
      "expected": "VALID",
      "source": "Let a, b, c, d : Real\nStep: (a + b)^2 = a^2 + 2*a*b + b^2\nStep: (3*a + 2*b)*(4*c + 2*d) = 12*a*c + 6*a*d + 8*b*c + 4*b*d\nStep: -a = (-1)*a\nStep: a*(-b) = (-a)*b\nAssume hb: b != 0\nAssume hd: d != 0\nStep: a/b + c/d = (a*d + b*c)/(b*d)\n"
    },
    {
      "id": "1-1-1-1-1-2-the-two-element-field",
      "chapter": "1",
      "ref": "§1.1 (1.1)–(1.2)",
      "title": "The two-element field",
      "kind": "proof",
      "expected": "VALID",
      "source": "Step: 1 + 1 = 0 (mod 2)\nStep: 1 * 1 = 1 (mod 2)\nStep: 0 + 1 = 1 (mod 2)\n"
    },
    {
      "id": "theorem-1-1-the-triangle-inequality-by-the-four-cases",
      "chapter": "1",
      "ref": "Theorem 1.1",
      "title": "The triangle inequality, by the four cases",
      "kind": "proof",
      "expected": "VALID",
      "source": "Theorem: \"The Triangle Inequality\"\nClaim: forall a : Real, forall b : Real, |a + b| <= |a| + |b|\nProof:\n    Given a, b : Real\n    Case a >= 0 and b >= 0:\n        Step: |a + b| = a + b\n        Step: = |a| + |b|\n    Case a <= 0 and b <= 0:\n        Step: |a + b| = -a + (-b)\n        Step: = |a| + |b|\n    Case a >= 0 and b <= 0:\n        Step: a + b = |a| - |b|\n        Step: |a + b| <= |a| + |b|\n    Case a <= 0 and b >= 0:\n        Step: a + b = -|a| + |b|\n        Step: |a + b| <= |a| + |b|\n    Therefore |a + b| <= |a| + |b|\nQED\n"
    },
    {
      "id": "corollary-1-2-the-reverse-triangle-inequality",
      "chapter": "1",
      "ref": "Corollary 1.2",
      "title": "The reverse triangle inequality",
      "kind": "proof",
      "expected": "VALID",
      "source": "Let a, b : Real\nStep: |a| = |(a - b) + b|\nStep: <= |a - b| + |b|\nStep: |a - b| >= |a| - |b|\nStep: |b - a| = |a - b|\nStep: |a - b| >= | |a| - |b| |\nStep: |a + b| >= | |a| - |b| |\n"
    },
    {
      "id": "corollary-1-2-reversing-the-inequality",
      "chapter": "1",
      "ref": "Corollary 1.2",
      "title": "Reversing the inequality",
      "kind": "trap",
      "expected": "INVALID",
      "source": "Let a, b : Real\nStep: |a - b| <= |a| - |b|\n",
      "explanation": "The corollary says |a − b| ≥ |a| − |b|. With the inequality flipped the claim fails at a = 0, b = 1: |−1| = 1 is not ≤ −1."
    },
    {
      "id": "theorem-1-4-uniqueness-of-the-supremum",
      "chapter": "1",
      "ref": "Theorem 1.4",
      "title": "Uniqueness of the supremum",
      "kind": "proof",
      "expected": "VALID",
      "source": "Theorem: \"Uniqueness of sup\"\nProof:\n    Let b1, b2, x0 : Real\n    Assume h1: b1 < b2\n    Let \\epsilon = b2 - b1\n    Step: \\epsilon > 0\n    Assume h2: x0 > b2 - \\epsilon\n    Step: x0 > b2 - (b2 - b1)\n    Step: = b1\n    Therefore x0 > b1\nQED\n"
    },
    {
      "id": "theorem-1-5-the-archimedean-step",
      "chapter": "1",
      "ref": "Theorem 1.5",
      "title": "The Archimedean step",
      "kind": "proof",
      "expected": "VALID",
      "source": "Let n : Int\nLet \\epsilon, \\beta : Real\nAssume h: (n + 1) * \\epsilon <= \\beta\nStep: n * \\epsilon <= \\beta - \\epsilon\n"
    },
    {
      "id": "theorem-1-7-the-rationals-are-dense",
      "chapter": "1",
      "ref": "Theorem 1.7",
      "title": "The rationals are dense",
      "kind": "proof",
      "expected": "VALID",
      "source": "Theorem: \"Density of the rationals (closing algebra)\"\nProof:\n    Let a, b : Real\n    Let p, q : Int\n    Assume hab: a < b\n    Assume hq: q > 0\n    Assume h1: q * (b - a) > 1\n    Assume h2: q * a < p\n    Assume h3: p <= q * a + 1\n    Step: p < q * a + q * (b - a)\n    Step: = q * b\n    Therefore a < p / q and p / q < b\nQED\n"
    },
    {
      "id": "theorem-1-9-the-irrationals-are-dense",
      "chapter": "1",
      "ref": "Theorem 1.9",
      "title": "The irrationals are dense",
      "kind": "proof",
      "expected": "VALID",
      "source": "Let a, b, r1, r2 : Real\nAssume a < r1\nAssume r1 < r2\nAssume r2 < b\nLet t = r1 + (r2 - r1) / sqrt(2)\nStep: t > r1\nStep: t < r2\nTherefore a < t and t < b\n"
    },
    {
      "id": "theorem-1-9-placing-t-on-the-wrong-side",
      "chapter": "1",
      "ref": "Theorem 1.9",
      "title": "Placing t on the wrong side",
      "kind": "trap",
      "expected": "INVALID",
      "source": "Let r1, r2 : Real\nAssume r1 < r2\nLet t = r1 + (r2 - r1) / sqrt(2)\nStep: t < r1\n",
      "explanation": "t = r1 + (r2 − r1)/√2 adds a positive amount to r1, so t > r1; claiming t < r1 contradicts r1 < r2."
    },
    {
      "id": "1-1-arithmetic-in-the-extended-reals",
      "chapter": "1",
      "ref": "§1.1",
      "title": "Arithmetic in the extended reals",
      "kind": "proof",
      "expected": "VALID",
      "source": "Let a : Real\nStep: a + oo = oo\nStep: a - oo = -oo\nStep: a / oo = 0\nStep: oo * oo = oo\nStep: (-oo) * (-oo) = oo\nStep: -oo < a\nStep: a < oo\n"
    },
    {
      "id": "1-1-cancelling-infinities",
      "chapter": "1",
      "ref": "§1.1",
      "title": "Cancelling infinities",
      "kind": "trap",
      "expected": "INVALID",
      "source": "Step: oo - oo = 0\n",
      "explanation": "∞ − ∞ is an indeterminate form: the notes leave it undefined, so it cannot equal 0."
    },
    {
      "id": "example-1-17-open-intervals-are-open",
      "chapter": "1",
      "ref": "Example 1.17",
      "title": "Open intervals are open",
      "kind": "proof",
      "expected": "VALID",
      "source": "Let a, b, x0, x, \\epsilon : Real\nAssume a < x0 and x0 < b\nAssume \\epsilon > 0 and \\epsilon <= min(x0 - a, b - x0)\nAssume |x - x0| < \\epsilon\nTherefore a < x and x < b\n"
    },
    {
      "id": "example-2-2-x-defines-a-function",
      "chapter": "2",
      "ref": "Example 2.2",
      "title": "√x defines a function",
      "kind": "proof",
      "expected": "VALID",
      "source": "Let x : Real\nAssume x >= 0\nStep: sqrt(x)^2 = x\nStep: sqrt(x) >= 0\nStep: (-sqrt(x))^2 = x\n"
    },
    {
      "id": "example-2-4-a-product-of-square-root-functions",
      "chapter": "2",
      "ref": "Example 2.4",
      "title": "A product of square-root functions",
      "kind": "proof",
      "expected": "VALID",
      "source": "Let x : Real\nAssume 1 <= x and x <= 2\nStep: sqrt(4 - x^2) * sqrt(x - 1) = sqrt((4 - x^2) * (x - 1))\n"
    },
    {
      "id": "example-2-7-lim-cx-cx-by",
      "chapter": "2",
      "ref": "Example 2.7",
      "title": "lim cx = cx₀, by ε–δ",
      "kind": "proof",
      "expected": "VALID",
      "source": "Theorem: \"Limit of cx\"\nProof:\n    Let c, x0 : Real\n    Assume hc: c != 0\n    Given \\epsilon : Real where \\epsilon > 0\n    Let \\delta = \\epsilon / |c|\n    Step: \\delta > 0\n    Subproof:\n        Given x : Real\n        Assume |x - x0| < \\delta\n        Step: |c * x - c * x0| = |c| * |x - x0|\n        Step: < |c| * \\delta\n        Step: = \\epsilon\n    Therefore exists \\delta : Real, \\delta > 0 and (forall x : Real, |x - x0| < \\delta => |c * x - c * x0| < \\epsilon) [witness: \\epsilon / |c|]\nQED\n"
    },
    {
      "id": "example-2-8-x-sin-1-x-0",
      "chapter": "2",
      "ref": "Example 2.8",
      "title": "x sin(1/x) → 0",
      "kind": "proof",
      "expected": "VALID",
      "source": "Let x, \\epsilon : Real\nAssume \\epsilon > 0\nAssume hx: 0 < |x| and |x| < \\epsilon\nStep: |x * sin(1/x)| = |x| * |sin(1/x)|\nStep: <= |x|\nStep: < \\epsilon\nStep: lim(x * sin(1/x), x, 0) = 0\n"
    },
    {
      "id": "example-2-8-a-bound-that-is-too-tight",
      "chapter": "2",
      "ref": "Example 2.8",
      "title": "A bound that is too tight",
      "kind": "trap",
      "expected": "INVALID",
      "source": "Let x : Real\nAssume x != 0\nStep: |x * sin(1/x)| <= |x| / 2\n",
      "explanation": "|sin(1/x)| can reach 1, so |x sin(1/x)| can equal |x|; it is not bounded by |x|/2."
    },
    {
      "id": "theorem-2-9-limits-are-unique",
      "chapter": "2",
      "ref": "Theorem 2.9",
      "title": "Limits are unique",
      "kind": "proof",
      "expected": "VALID",
      "source": "Let x, L1, L2, \\epsilon : Real\nAssume \\epsilon > 0\nAssume h1: |f(x) - L1| < \\epsilon\nAssume h2: |f(x) - L2| < \\epsilon\nStep: |L1 - L2| = |(L1 - f(x)) + (f(x) - L2)|\nStep: <= |L1 - f(x)| + |f(x) - L2|\nStep: < 2 * \\epsilon\n"
    },
    {
      "id": "theorem-2-10-the-product-limit-identity",
      "chapter": "2",
      "ref": "Theorem 2.10",
      "title": "The product-limit identity",
      "kind": "proof",
      "expected": "VALID",
      "source": "Let x, L1, L2 : Real\nStep: f(x) * g(x) - L1 * L2 = f(x) * (g(x) - L2) + L2 * (f(x) - L1)\nStep: |f(x)| <= |f(x) - L1| + |L1|\n"
    },
    {
      "id": "example-2-11-limits-by-theorem-2-10",
      "chapter": "2",
      "ref": "Example 2.11",
      "title": "Limits by Theorem 2.10",
      "kind": "proof",
      "expected": "VALID",
      "source": "Step: lim(9 - x^2, x, 2) = 5\nStep: lim(x + 1, x, 2) = 3\nStep: lim((9 - x^2)/(x + 1), x, 2) = 5/3\nStep: lim((9 - x^2)*(x + 1), x, 2) = 15\nStep: \\lim_{x \\to 2} (9 - x^2)/(x + 1) = 5/3\n"
    },
    {